{
  "$schema": "./bid-manager-reference.schema.json",
  "version": "2.0",
  "lastUpdated": "2025-01-15",
  "source": "https://developers.google.com/bid-manager/reference/rest/v2/filters-metrics",
  "filters": {
    "FILTER_ACTIVE_VIEW_CUSTOM_METRIC_ID": {
      "displayName": "Active View Custom Metric ID",
      "reportBuilderName": "Active View: Custom Metric ID",
      "category": "Viewability",
      "description": "Custom metric ID for Active View measurement",
      "usage": ["filter", "groupBy"],
      "reportTypes": ["STANDARD", "FLOODLIGHT", "AUDIENCE_COMPOSITION"]
    },
    "FILTER_ACTIVE_VIEW_CUSTOM_METRIC_NAME": {
      "displayName": "Active View Custom Metric Name",
      "reportBuilderName": "Active View: Custom Metric Name",
      "category": "Viewability",
      "description": "Custom metric name for Active View measurement",
      "usage": ["filter", "groupBy"],
      "reportTypes": ["STANDARD", "FLOODLIGHT", "AUDIENCE_COMPOSITION"]
    },
    "FILTER_ACTIVE_VIEW_EXPECTED_VIEWABILITY": {
      "displayName": "Active View Expected Viewability",
      "reportBuilderName": "Active View Expected Viewability",
      "category": "Viewability",
      "description": "Expected viewability percentage from Active View",
      "usage": ["filter", "groupBy"],
      "reportTypes": ["STANDARD", "FLOODLIGHT", "AUDIENCE_COMPOSITION"]
    },
    "FILTER_ADVERTISER": {
      "displayName": "Advertiser ID",
      "reportBuilderName": "Advertiser ID",
      "category": "Entity",
      "description": "DV360 Advertiser ID for filtering or grouping",
      "usage": ["filter", "groupBy"],
      "reportTypes": ["STANDARD", "FLOODLIGHT", "AUDIENCE_COMPOSITION"]
    },
    "FILTER_ADVERTISER_CURRENCY": {
      "displayName": "Advertiser Currency",
      "reportBuilderName": "Advertiser Currency",
      "category": "Entity",
      "description": "Currency code for the advertiser",
      "usage": ["filter", "groupBy"],
      "reportTypes": ["STANDARD", "FLOODLIGHT", "AUDIENCE_COMPOSITION"]
    },
    "FILTER_ADVERTISER_INTEGRATION_CODE": {
      "displayName": "Advertiser Integration Code",
      "reportBuilderName": "Advertiser Integration Code",
      "category": "Entity",
      "description": "Custom integration code for advertiser",
      "usage": ["filter", "groupBy"],
      "reportTypes": ["STANDARD", "FLOODLIGHT", "AUDIENCE_COMPOSITION"]
    },
    "FILTER_ADVERTISER_INTEGRATION_STATUS": {
      "displayName": "Advertiser Status",
      "reportBuilderName": "Advertiser Status",
      "category": "Entity",
      "description": "Integration status of the advertiser",
      "usage": ["filter", "groupBy"],
      "reportTypes": ["STANDARD", "FLOODLIGHT", "AUDIENCE_COMPOSITION"]
    },
    "FILTER_ADVERTISER_NAME": {
      "displayName": "Advertiser",
      "reportBuilderName": "Advertiser",
      "category": "Entity",
      "description": "Advertiser name",
      "usage": ["filter", "groupBy"],
      "reportTypes": ["STANDARD", "FLOODLIGHT", "AUDIENCE_COMPOSITION"]
    },
    "FILTER_ADVERTISER_TIMEZONE": {
      "displayName": "Advertiser Time Zone",
      "reportBuilderName": "Advertiser Time Zone",
      "category": "Entity",
      "description": "Time zone setting for the advertiser",
      "usage": ["filter", "groupBy"],
      "reportTypes": ["STANDARD", "FLOODLIGHT", "AUDIENCE_COMPOSITION"]
    },
    "FILTER_AD_POSITION": {
      "displayName": "Ad Position",
      "reportBuilderName": "Ad Position",
      "category": "Inventory",
      "description": "Position of the ad on the page",
      "usage": ["filter", "groupBy"],
      "reportTypes": ["STANDARD", "FLOODLIGHT", "AUDIENCE_COMPOSITION"]
    },
    "FILTER_AD_TYPE": {
      "displayName": "Ad Type",
      "reportBuilderName": "Ad Type",
      "category": "Creative",
      "description": "Type of advertisement",
      "usage": ["filter", "groupBy"],
      "reportTypes": ["STANDARD", "FLOODLIGHT", "AUDIENCE_COMPOSITION"]
    },
    "FILTER_AGE": {
      "displayName": "Age",
      "reportBuilderName": "Age",
      "category": "Audience",
      "description": "Age demographic segment",
      "usage": ["filter", "groupBy"],
      "reportTypes": ["STANDARD", "FLOODLIGHT", "AUDIENCE_COMPOSITION"]
    },
    "FILTER_ALGORITHM": {
      "displayName": "Algorithm",
      "reportBuilderName": "Algorithm",
      "category": "Bidding",
      "description": "Bidding algorithm name",
      "usage": ["filter", "groupBy"],
      "reportTypes": ["STANDARD", "FLOODLIGHT", "AUDIENCE_COMPOSITION"]
    },
    "FILTER_ALGORITHM_ID": {
      "displayName": "Algorithm ID",
      "reportBuilderName": "Algorithm ID",
      "category": "Bidding",
      "description": "Bidding algorithm ID",
      "usage": ["filter", "groupBy"],
      "reportTypes": ["STANDARD", "FLOODLIGHT", "AUDIENCE_COMPOSITION"]
    },
    "FILTER_AMP_PAGE_REQUEST": {
      "displayName": "AMP Page Request",
      "reportBuilderName": "AMP Page Request",
      "category": "Inventory",
      "description": "Whether the request came from an AMP page",
      "usage": ["filter", "groupBy"],
      "reportTypes": ["STANDARD", "FLOODLIGHT", "AUDIENCE_COMPOSITION"]
    },
    "FILTER_APP_URL": {
      "displayName": "App/URL",
      "reportBuilderName": "App/URL",
      "category": "Inventory",
      "description": "Application or website URL",
      "usage": ["filter", "groupBy"],
      "reportTypes": ["STANDARD", "FLOODLIGHT", "AUDIENCE_COMPOSITION"]
    },
    "FILTER_APP_URL_EXCLUDED": {
      "displayName": "App/URL Excluded",
      "reportBuilderName": "App/URL Excluded",
      "category": "Inventory",
      "description": "Excluded applications or URLs",
      "usage": ["filter", "groupBy"],
      "reportTypes": ["STANDARD", "FLOODLIGHT", "AUDIENCE_COMPOSITION"]
    },
    "FILTER_ASSET_COMBINATION_STRING": {
      "displayName": "Asset Combination",
      "reportBuilderName": "Asset Combination",
      "category": "Creative",
      "description": "Combination of creative assets",
      "usage": ["filter", "groupBy"],
      "reportTypes": ["STANDARD", "FLOODLIGHT", "AUDIENCE_COMPOSITION"]
    },
    "FILTER_ATTRIBUTED_USERLIST": {
      "displayName": "Attributed Userlist",
      "reportBuilderName": "Attributed Userlist",
      "category": "Audience",
      "description": "User list attributed to conversion",
      "usage": ["filter", "groupBy"],
      "reportTypes": ["STANDARD", "FLOODLIGHT", "AUDIENCE_COMPOSITION"]
    },
    "FILTER_ATTRIBUTED_USERLIST_COMMERCE_PARTNER": {
      "displayName": "Commerce Partner",
      "reportBuilderName": "Commerce Partner",
      "category": "Audience",
      "description": "Commerce partner for attributed userlist",
      "usage": ["filter", "groupBy"],
      "reportTypes": ["STANDARD", "FLOODLIGHT", "AUDIENCE_COMPOSITION"]
    },
    "FILTER_ATTRIBUTED_USERLIST_COST": {
      "displayName": "Attributed Userlist Cost",
      "reportBuilderName": "Attributed Userlist Cost",
      "category": "Audience",
      "description": "Cost associated with attributed userlist",
      "usage": ["filter", "groupBy"],
      "reportTypes": ["STANDARD", "FLOODLIGHT", "AUDIENCE_COMPOSITION"]
    },
    "FILTER_ATTRIBUTED_USERLIST_IS_COMMERCE": {
      "displayName": "Is Commerce",
      "reportBuilderName": "Is Commerce",
      "category": "Audience",
      "description": "Whether the userlist is commerce-related",
      "usage": ["filter", "groupBy"],
      "reportTypes": ["STANDARD", "FLOODLIGHT", "AUDIENCE_COMPOSITION"]
    },
    "FILTER_ATTRIBUTED_USERLIST_TYPE": {
      "displayName": "Attributed Userlist Type",
      "reportBuilderName": "Attributed Userlist Type",
      "category": "Audience",
      "description": "Type of attributed userlist",
      "usage": ["filter", "groupBy"],
      "reportTypes": ["STANDARD", "FLOODLIGHT", "AUDIENCE_COMPOSITION"]
    },
    "FILTER_ATTRIBUTION_MODEL": {
      "displayName": "Attribution Model",
      "reportBuilderName": "Attribution Model",
      "category": "Conversion",
      "description": "Attribution model used for conversions",
      "usage": ["filter", "groupBy"],
      "reportTypes": ["STANDARD", "FLOODLIGHT", "AUDIENCE_COMPOSITION"]
    },
    "FILTER_AUDIENCE_LIST": {
      "displayName": "Audience List",
      "reportBuilderName": "Audience List",
      "category": "Audience",
      "description": "Audience list ID or name",
      "usage": ["filter", "groupBy"],
      "reportTypes": ["STANDARD", "FLOODLIGHT", "AUDIENCE_COMPOSITION"]
    },
    "FILTER_AUDIENCE_LIST_COST": {
      "displayName": "Audience List Cost",
      "reportBuilderName": "Audience List Cost",
      "category": "Audience",
      "description": "Cost of audience list usage",
      "usage": ["filter", "groupBy"],
      "reportTypes": ["STANDARD", "FLOODLIGHT", "AUDIENCE_COMPOSITION"]
    },
    "FILTER_AUDIENCE_LIST_TYPE": {
      "displayName": "Audience List Type",
      "reportBuilderName": "Audience List Type",
      "category": "Audience",
      "description": "Type of audience list",
      "usage": ["filter", "groupBy"],
      "reportTypes": ["STANDARD", "FLOODLIGHT", "AUDIENCE_COMPOSITION"]
    },
    "FILTER_AUDIO_FEED_TYPE_NAME": {
      "displayName": "Audio Feed Type",
      "reportBuilderName": "Audio Feed Type",
      "category": "Audio",
      "description": "Type of audio content feed",
      "usage": ["filter", "groupBy"],
      "reportTypes": ["STANDARD", "FLOODLIGHT", "AUDIENCE_COMPOSITION"]
    },
    "FILTER_AUTHORIZED_SELLER_STATE": {
      "displayName": "Authorized Seller State",
      "reportBuilderName": "Authorized Seller State",
      "category": "Inventory",
      "description": "Authorization state of the seller",
      "usage": ["filter", "groupBy"],
      "reportTypes": ["STANDARD", "FLOODLIGHT", "AUDIENCE_COMPOSITION"]
    },
    "FILTER_BID_STRATEGY_TYPE_NAME": {
      "displayName": "Bid Strategy Type",
      "reportBuilderName": "Bid Strategy Type",
      "category": "Bidding",
      "description": "Type of bidding strategy",